{
  "aggregate": {
    "branch_percent": 95.04,
    "branches": 3526,
    "covered_branches": 3351,
    "covered_statements": 10094,
    "missing_branches": 175,
    "missing_statements": 175,
    "statement_percent": 98.3,
    "statements": 10269
  },
  "coverage_source": "coverage.json",
  "critical_failures": [],
  "critical_policy": {
    "minimum_branch_percent": 95.0,
    "minimum_statement_percent": 98.0,
    "modules": [
      "orchestra_runtime/evidence.py",
      "orchestra_runtime/machine_contracts.py",
      "orchestra_runtime/compliance_protocol.py",
      "orchestra_runtime/governance_kernel.py",
      "orchestra_runtime/preexecution.py",
      "orchestra_runtime/context_state.py",
      "orchestra_runtime/host_protocol.py",
      "orchestra_runtime/remediation_circuit.py",
      "orchestra_runtime/shadow_conformance.py",
      "orchestra_runtime/test_evidence.py",
      "orchestra_runtime/workflow_contracts.py"
    ]
  },
  "critical_ready": true,
  "generated_at": "2026-08-26T12:21:06Z",
  "modules": [
    {
      "branch_percent": 100.0,
      "branches": 4,
      "covered_branches": 4,
      "covered_statements": 32,
      "critical": false,
      "excluded_lines": [],
      "missing_branches": 0,
      "missing_lines": [
        266
      ],
      "missing_statements": 1,
      "path": "orchestra_runtime\\__init__.py",
      "statement_percent": 96.97,
      "statements": 33
    },
    {
      "branch_percent": 100.0,
      "branches": 4,
      "covered_branches": 4,
      "covered_statements": 121,
      "critical": false,
      "excluded_lines": [],
      "missing_branches": 0,
      "missing_lines": [],
      "missing_statements": 0,
      "path": "orchestra_runtime\\adapters.py",
      "statement_percent": 100.0,
      "statements": 121
    },
    {
      "branch_percent": 100.0,
      "branches": 0,
      "covered_branches": 0,
      "covered_statements": 6,
      "critical": false,
      "excluded_lines": [],
      "missing_branches": 0,
      "missing_lines": [],
      "missing_statements": 0,
      "path": "orchestra_runtime\\adaptive\\__init__.py",
      "statement_percent": 100.0,
      "statements": 6
    },
    {
      "branch_percent": 96.05,
      "branches": 76,
      "covered_branches": 73,
      "covered_statements": 221,
      "critical": false,
      "excluded_lines": [
        189,
        190,
        191,
        192,
        193,
        194,
        195,
        196
      ],
      "missing_branches": 3,
      "missing_lines": [
        317,
        421,
        441
      ],
      "missing_statements": 3,
      "path": "orchestra_runtime\\adaptive\\context.py",
      "statement_percent": 98.66,
      "statements": 224
    },
    {
      "branch_percent": 98.18,
      "branches": 110,
      "covered_branches": 108,
      "covered_statements": 274,
      "critical": false,
      "excluded_lines": [],
      "missing_branches": 2,
      "missing_lines": [
        113,
        138
      ],
      "missing_statements": 2,
      "path": "orchestra_runtime\\adaptive\\models.py",
      "statement_percent": 99.28,
      "statements": 276
    },
    {
      "branch_percent": 0.0,
      "branches": 2,
      "covered_branches": 0,
      "covered_statements": 12,
      "critical": false,
      "excluded_lines": [],
      "missing_branches": 2,
      "missing_lines": [
        88,
        89,
        90
      ],
      "missing_statements": 3,
      "path": "orchestra_runtime\\adaptive\\observations.py",
      "statement_percent": 80.0,
      "statements": 15
    },
    {
      "branch_percent": 77.78,
      "branches": 18,
      "covered_branches": 14,
      "covered_statements": 59,
      "critical": false,
      "excluded_lines": [
        90,
        91,
        92,
        93,
        94,
        95
      ],
      "missing_branches": 4,
      "missing_lines": [
        53,
        65,
        67,
        115
      ],
      "missing_statements": 4,
      "path": "orchestra_runtime\\adaptive\\portable_memory.py",
      "statement_percent": 93.65,
      "statements": 63
    },
    {
      "branch_percent": 100.0,
      "branches": 4,
      "covered_branches": 4,
      "covered_statements": 27,
      "critical": false,
      "excluded_lines": [],
      "missing_branches": 0,
      "missing_lines": [],
      "missing_statements": 0,
      "path": "orchestra_runtime\\adaptive\\privacy.py",
      "statement_percent": 100.0,
      "statements": 27
    },
    {
      "branch_percent": 62.5,
      "branches": 32,
      "covered_branches": 20,
      "covered_statements": 52,
      "critical": false,
      "excluded_lines": [],
      "missing_branches": 12,
      "missing_lines": [
        27,
        29,
        44,
        64,
        67,
        79,
        80,
        81,
        82,
        90,
        92,
        158,
        162
      ],
      "missing_statements": 13,
      "path": "orchestra_runtime\\adaptive\\profile.py",
      "statement_percent": 80.0,
      "statements": 65
    },
    {
      "branch_percent": 93.29,
      "branches": 164,
      "covered_branches": 153,
      "covered_statements": 438,
      "critical": false,
      "excluded_lines": [],
      "missing_branches": 11,
      "missing_lines": [
        376,
        432,
        580,
        583,
        631,
        634,
        1002
      ],
      "missing_statements": 7,
      "path": "orchestra_runtime\\adaptive\\selection.py",
      "statement_percent": 98.43,
      "statements": 445
    },
    {
      "branch_percent": 90.74,
      "branches": 54,
      "covered_branches": 49,
      "covered_statements": 132,
      "critical": false,
      "excluded_lines": [
        130,
        131,
        132,
        133,
        134,
        135,
        136
      ],
      "missing_branches": 5,
      "missing_lines": [
        124,
        156,
        215,
        235,
        335
      ],
      "missing_statements": 5,
      "path": "orchestra_runtime\\adaptive\\selection_runtime.py",
      "statement_percent": 96.35,
      "statements": 137
    },
    {
      "branch_percent": 98.88,
      "branches": 178,
      "covered_branches": 176,
      "covered_statements": 462,
      "critical": false,
      "excluded_lines": [],
      "missing_branches": 2,
      "missing_lines": [
        242,
        744
      ],
      "missing_statements": 2,
      "path": "orchestra_runtime\\adaptive\\shadow.py",
      "statement_percent": 99.57,
      "statements": 464
    },
    {
      "branch_percent": 80.95,
      "branches": 42,
      "covered_branches": 34,
      "covered_statements": 153,
      "critical": false,
      "excluded_lines": [],
      "missing_branches": 8,
      "missing_lines": [
        46,
        69,
        232,
        237,
        290,
        291,
        292,
        293,
        294,
        295,
        296
      ],
      "missing_statements": 11,
      "path": "orchestra_runtime\\adaptive\\store.py",
      "statement_percent": 93.29,
      "statements": 164
    },
    {
      "branch_percent": 92.7,
      "branches": 178,
      "covered_branches": 165,
      "covered_statements": 475,
      "critical": false,
      "excluded_lines": [],
      "missing_branches": 13,
      "missing_lines": [
        338,
        340,
        477,
        502,
        556,
        576,
        578,
        644,
        647,
        653,
        656,
        832,
        1235
      ],
      "missing_statements": 13,
      "path": "orchestra_runtime\\adaptive\\topology.py",
      "statement_percent": 97.34,
      "statements": 488
    },
    {
      "branch_percent": 90.28,
      "branches": 72,
      "covered_branches": 65,
      "covered_statements": 278,
      "critical": false,
      "excluded_lines": [],
      "missing_branches": 7,
      "missing_lines": [
        87,
        186,
        219,
        307,
        315,
        337,
        481
      ],
      "missing_statements": 7,
      "path": "orchestra_runtime\\authority.py",
      "statement_percent": 97.54,
      "statements": 285
    },
    {
      "branch_percent": 90.38,
      "branches": 52,
      "covered_branches": 47,
      "covered_statements": 194,
      "critical": false,
      "excluded_lines": [],
      "missing_branches": 5,
      "missing_lines": [
        128,
        322,
        334,
        381,
        392
      ],
      "missing_statements": 5,
      "path": "orchestra_runtime\\capabilities.py",
      "statement_percent": 97.49,
      "statements": 199
    },
    {
      "branch_percent": 100.0,
      "branches": 22,
      "covered_branches": 22,
      "covered_statements": 119,
      "critical": false,
      "excluded_lines": [],
      "missing_branches": 0,
      "missing_lines": [],
      "missing_statements": 0,
      "path": "orchestra_runtime\\communication_budget.py",
      "statement_percent": 100.0,
      "statements": 119
    },
    {
      "branch_percent": 100.0,
      "branches": 82,
      "covered_branches": 82,
      "covered_statements": 233,
      "critical": false,
      "excluded_lines": [],
      "missing_branches": 0,
      "missing_lines": [],
      "missing_statements": 0,
      "path": "orchestra_runtime\\compliance_protocol.py",
      "statement_percent": 100.0,
      "statements": 233
    },
    {
      "branch_percent": 100.0,
      "branches": 58,
      "covered_branches": 58,
      "covered_statements": 165,
      "critical": false,
      "excluded_lines": [],
      "missing_branches": 0,
      "missing_lines": [],
      "missing_statements": 0,
      "path": "orchestra_runtime\\context_state.py",